No.     Time        Source                Destination           Protocol Info
     14 2.627067    172.16.60.5           172.16.60.1           TCP      59222 > pop3 [SYN] Seq=0 Win=14600 Len=0 MSS=1460 SACK_PERM=1 TSV=50324917 TSER=0 WS=7
     15 2.627073    172.16.60.5           172.16.60.1           TCP      59222 > pop3 [SYN] Seq=0 Win=14600 Len=0 MSS=1460 SACK_PERM=1 TSV=50324917 TSER=0 WS=7
     16 2.627226    172.16.60.1           172.16.60.5           TCP      pop3 > 59222 [SYN, ACK] Seq=0 Ack=1 Win=5792 Len=0 MSS=1460 SACK_PERM=1 TSV=13050218 TSER=50324917 WS=5
     17 2.627232    172.16.60.1           172.16.60.5           TCP      pop3 > 59222 [SYN, ACK] Seq=0 Ack=1 Win=5792 Len=0 MSS=1460 SACK_PERM=1 TSV=13050218 TSER=50324917 WS=5
     18 2.627284    172.16.60.5           172.16.60.1           TCP      59222 > pop3 [ACK] Seq=1 Ack=1 Win=14720 Len=0 TSV=50324918 TSER=13050218
     19 2.627287    172.16.60.5           172.16.60.1           TCP      [TCP Dup ACK 18#1] 59222 > pop3 [ACK] Seq=1 Ack=1 Win=14720 Len=0 TSV=50324918 TSER=13050218
     20 2.630085    172.16.60.1           172.16.60.5           POP      S: +OK Hello there.
     21 2.630089    172.16.60.1           172.16.60.5           POP      [TCP Out-Of-Order] S: +OK Hello there.
     22 2.630172    172.16.60.5           172.16.60.1           TCP      59222 > pop3 [ACK] Seq=1 Ack=19 Win=14720 Len=0 TSV=50324921 TSER=13050219
     23 2.630175    172.16.60.5           172.16.60.1           TCP      [TCP Dup ACK 22#1] 59222 > pop3 [ACK] Seq=1 Ack=19 Win=14720 Len=0 TSV=50324921 TSER=13050219
     24 2.630332    172.16.60.5           172.16.60.1           POP      C: CAPA
     25 2.630335    172.16.60.5           172.16.60.1           POP      [TCP Out-Of-Order] C: CAPA
     26 2.630871    172.16.60.1           172.16.60.5           TCP      pop3 > 59222 [ACK] Seq=19 Ack=7 Win=5792 Len=0 TSV=13050219 TSER=50324921
     27 2.630874    172.16.60.1           172.16.60.5           TCP      [TCP Dup ACK 26#1] pop3 > 59222 [ACK] Seq=19 Ack=7 Win=5792 Len=0 TSV=13050219 TSER=50324921
     28 2.630986    172.16.60.1           172.16.60.5           POP      S: +OK Here's what I can do:
     29 2.631000    172.16.60.1           172.16.60.5           POP      [TCP Out-Of-Order] S: +OK Here's what I can do:
     30 2.631777    172.16.60.5           172.16.60.1           POP      C: USER user1
     31 2.631779    172.16.60.5           172.16.60.1           POP      [TCP Out-Of-Order] C: USER user1
     32 2.632245    172.16.60.1           172.16.60.5           POP      S: +OK Password required.
     33 2.632249    172.16.60.1           172.16.60.5           POP      [TCP Out-Of-Order] S: +OK Password required.
     34 2.632694    172.16.60.5           172.16.60.1           POP      C: PASS user1
     35 2.632696    172.16.60.5           172.16.60.1           POP      [TCP Out-Of-Order] C: PASS user1
     36 2.645806    172.16.60.1           172.16.60.5           POP      S: +OK logged in.
     37 2.645809    172.16.60.1           172.16.60.5           POP      [TCP Out-Of-Order] S: +OK logged in.
     38 2.646051    172.16.60.5           172.16.60.1           POP      C: STAT
     39 2.646054    172.16.60.5           172.16.60.1           POP      [TCP Out-Of-Order] C: STAT
     40 2.646239    172.16.60.1           172.16.60.5           POP      S: +OK 3 2616
     41 2.646242    172.16.60.1           172.16.60.5           POP      [TCP Out-Of-Order] S: +OK 3 2616
     42 2.648135    172.16.60.5           172.16.60.1           POP      C: LIST
     43 2.648138    172.16.60.5           172.16.60.1           POP      [TCP Out-Of-Order] C: LIST
     44 2.648250    172.16.60.1           172.16.60.5           POP      S: +OK POP3 clients that break here, they violate STD53.
     45 2.648264    172.16.60.1           172.16.60.5           POP      [TCP Out-Of-Order] S: +OK POP3 clients that break here, they violate STD53.
     46 2.649537    172.16.60.5           172.16.60.1           POP      C: UIDL
     47 2.649540    172.16.60.5           172.16.60.1           POP      [TCP Out-Of-Order] C: UIDL
     48 2.649644    172.16.60.1           172.16.60.5           POP      S: +OK
     49 2.649647    172.16.60.1           172.16.60.5           POP      [TCP Out-Of-Order] S: +OK
     50 2.650630    172.16.60.5           172.16.60.1           POP      C: RETR 3
     51 2.650632    172.16.60.5           172.16.60.1           POP      [TCP Out-Of-Order] C: RETR 3
     52 2.650996    172.16.60.1           172.16.60.5           POP      S: +OK 699 octets follow.
     53 2.650999    172.16.60.1           172.16.60.5           POP      [TCP Out-Of-Order] S: +OK 699 octets follow.
     54 2.690212    172.16.60.5           172.16.60.1           TCP      59222 > pop3 [ACK] Seq=57 Ack=1053 Win=16128 Len=0 TSV=50324981 TSER=13050224
     55 2.690214    172.16.60.5           172.16.60.1           TCP      [TCP Dup ACK 54#1] 59222 > pop3 [ACK] Seq=57 Ack=1053 Win=16128 Len=0 TSV=50324981 TSER=13050224
     56 2.717992    172.16.60.5           172.16.60.1           POP      C: QUIT
     57 2.717995    172.16.60.5           172.16.60.1           POP      [TCP Out-Of-Order] C: QUIT
     58 2.718090    172.16.60.1           172.16.60.5           POP      S: +OK Bye-bye.
     59 2.718093    172.16.60.1           172.16.60.5           POP      [TCP Out-Of-Order] S: +OK Bye-bye.
     60 2.718191    172.16.60.5           172.16.60.1           TCP      59222 > pop3 [ACK] Seq=63 Ack=1067 Win=16128 Len=0 TSV=50325009 TSER=13050241
     61 2.718194    172.16.60.5           172.16.60.1           TCP      [TCP Dup ACK 60#1] 59222 > pop3 [ACK] Seq=63 Ack=1067 Win=16128 Len=0 TSV=50325009 TSER=13050241
     62 2.718340    172.16.60.1           172.16.60.5           TCP      pop3 > 59222 [FIN, ACK] Seq=1067 Ack=63 Win=5792 Len=0 TSV=13050241 TSER=50325009
     63 2.718342    172.16.60.1           172.16.60.5           TCP      pop3 > 59222 [FIN, ACK] Seq=1067 Ack=63 Win=5792 Len=0 TSV=13050241 TSER=50325009
     64 2.724933    172.16.60.5           172.16.60.1           TCP      59222 > pop3 [FIN, ACK] Seq=63 Ack=1068 Win=16128 Len=0 TSV=50325015 TSER=13050241
     65 2.724937    172.16.60.5           172.16.60.1           TCP      59222 > pop3 [FIN, ACK] Seq=63 Ack=1068 Win=16128 Len=0 TSV=50325015 TSER=13050241
     66 2.725057    172.16.60.1           172.16.60.5           TCP      pop3 > 59222 [ACK] Seq=1068 Ack=64 Win=5792 Len=0 TSV=13050243 TSER=50325015
     67 2.725059    172.16.60.1           172.16.60.5           TCP      [TCP Dup ACK 66#1] pop3 > 59222 [ACK] Seq=1068 Ack=64 Win=5792 Len=0 TSV=13050243 TSER=50325015
